{
  "device": "DDJ-FLX4",
  "vendor": "AlphaTheta / Pioneer DJ",
  "usb": {
    "name": "DDJ-FLX4",
    "vid": "0x2b73",
    "pid": "0x0045"
  },
  "source": {
    "url": "https://downloads.support.alphatheta.com/software_info/dj-controllers/DDJ-FLX4/DDJ-FLX4_MIDI_message_List_E1.pdf",
    "sha256": "e03ac376ebaa2d461c1a2c832c3c182e3579c893a1531944ebac1b5ce620388f",
    "filename": "DDJ-FLX4_MIDI_message_List_E1.pdf"
  },
  "control_count": 402,
  "controls": [
    {
      "id": "deck1_play_pause",
      "name": "PLAY/PAUSE",
      "fig": "1-1",
      "section": "deck",
      "deck": 1,
      "shift": false,
      "ch": 1,
      "kind": "note",
      "code": 11,
      "status": 144
    },
    {
      "id": "deck1_play_pause_shift",
      "name": "PLAY/PAUSE +SHIFT",
      "fig": "1-1",
      "section": "deck",
      "deck": 1,
      "shift": true,
      "ch": 1,
      "kind": "note",
      "code": 14,
      "status": 144
    },
    {
      "id": "deck1_cue",
      "name": "CUE",
      "fig": "1-2",
      "section": "deck",
      "deck": 1,
      "shift": false,
      "ch": 1,
      "kind": "note",
      "code": 12,
      "status": 144
    },
    {
      "id": "deck1_cue_shift",
      "name": "CUE +SHIFT",
      "fig": "1-2",
      "section": "deck",
      "deck": 1,
      "shift": true,
      "ch": 1,
      "kind": "note",
      "code": 72,
      "status": 144
    },
    {
      "id": "deck1_shift",
      "name": "SHIFT",
      "fig": "1-3",
      "section": "deck",
      "deck": 1,
      "shift": false,
      "ch": 1,
      "kind": "note",
      "code": 63,
      "status": 144
    },
    {
      "id": "deck1_jog_vinyl_on",
      "name": "JOG DIAL vinyl on",
      "fig": "1-4",
      "section": "deck",
      "deck": 1,
      "shift": false,
      "ch": 1,
      "kind": "cc",
      "code": 34,
      "status": 176
    },
    {
      "id": "deck1_jog_vinyl_off",
      "name": "JOG DIAL vinyl off",
      "fig": "1-4",
      "section": "deck",
      "deck": 1,
      "shift": false,
      "ch": 1,
      "kind": "cc",
      "code": 35,
      "status": 176
    },
    {
      "id": "deck1_jog_vinyl_shift",
      "name": "JOG DIAL +SHIFT",
      "fig": "1-4",
      "section": "deck",
      "deck": 1,
      "shift": true,
      "ch": 1,
      "kind": "cc",
      "code": 41,
      "status": 176
    },
    {
      "id": "deck1_jog_touch",
      "name": "JOG DIAL touch",
      "fig": "1-4",
      "section": "deck",
      "deck": 1,
      "shift": false,
      "ch": 1,
      "kind": "note",
      "code": 54,
      "status": 144
    },
    {
      "id": "deck1_jog_touch_shift",
      "name": "JOG DIAL touch +SHIFT",
      "fig": "1-4",
      "section": "deck",
      "deck": 1,
      "shift": true,
      "ch": 1,
      "kind": "note",
      "code": 103,
      "status": 144
    },
    {
      "id": "deck1_jog_wheel",
      "name": "JOG DIAL wheel side",
      "fig": "1-4",
      "section": "deck",
      "deck": 1,
      "shift": false,
      "ch": 1,
      "kind": "cc",
      "code": 33,
      "status": 176
    },
    {
      "id": "deck1_in",
      "name": "IN",
      "fig": "1-5",
      "section": "deck",
      "deck": 1,
      "shift": false,
      "ch": 1,
      "kind": "note",
      "code": 16,
      "status": 144
    },
    {
      "id": "deck1_in_shift",
      "name": "IN +SHIFT",
      "fig": "1-5",
      "section": "deck",
      "deck": 1,
      "shift": true,
      "ch": 1,
      "kind": "note",
      "code": 76,
      "status": 144
    },
    {
      "id": "deck1_out",
      "name": "OUT",
      "fig": "1-6",
      "section": "deck",
      "deck": 1,
      "shift": false,
      "ch": 1,
      "kind": "note",
      "code": 17,
      "status": 144
    },
    {
      "id": "deck1_out_shift",
      "name": "OUT +SHIFT",
      "fig": "1-6",
      "section": "deck",
      "deck": 1,
      "shift": true,
      "ch": 1,
      "kind": "note",
      "code": 78,
      "status": 144
    },
    {
      "id": "deck1_four_beat_exit",
      "name": "4 BEAT / EXIT",
      "fig": "1-7",
      "section": "deck",
      "deck": 1,
      "shift": false,
      "ch": 1,
      "kind": "note",
      "code": 77,
      "status": 144
    },
    {
      "id": "deck1_four_beat_exit_shift",
      "name": "4 BEAT / EXIT +SHIFT",
      "fig": "1-7",
      "section": "deck",
      "deck": 1,
      "shift": true,
      "ch": 1,
      "kind": "note",
      "code": 80,
      "status": 144
    },
    {
      "id": "deck1_cue_loop_prev",
      "name": "CUE/LOOP CALL back",
      "fig": "1-8",
      "section": "deck",
      "deck": 1,
      "shift": false,
      "ch": 1,
      "kind": "note",
      "code": 81,
      "status": 144
    },
    {
      "id": "deck1_cue_loop_prev_shift",
      "name": "CUE/LOOP CALL back +SHIFT",
      "fig": "1-8",
      "section": "deck",
      "deck": 1,
      "shift": true,
      "ch": 1,
      "kind": "note",
      "code": 62,
      "status": 144
    },
    {
      "id": "deck1_cue_loop_next",
      "name": "CUE/LOOP CALL forward",
      "fig": "1-9",
      "section": "deck",
      "deck": 1,
      "shift": false,
      "ch": 1,
      "kind": "note",
      "code": 83,
      "status": 144
    },
    {
      "id": "deck1_cue_loop_next_shift",
      "name": "CUE/LOOP CALL forward +SHIFT",
      "fig": "1-9",
      "section": "deck",
      "deck": 1,
      "shift": true,
      "ch": 1,
      "kind": "note",
      "code": 61,
      "status": 144
    },
    {
      "id": "deck1_beat_sync",
      "name": "BEAT SYNC",
      "fig": "1-10",
      "section": "deck",
      "deck": 1,
      "shift": false,
      "ch": 1,
      "kind": "note",
      "code": 88,
      "status": 144
    },
    {
      "id": "deck1_beat_sync_long",
      "name": "BEAT SYNC long press",
      "fig": "1-10",
      "section": "deck",
      "deck": 1,
      "shift": false,
      "ch": 1,
      "kind": "note",
      "code": 92,
      "status": 144
    },
    {
      "id": "deck1_beat_sync_shift",
      "name": "BEAT SYNC +SHIFT",
      "fig": "1-10",
      "section": "deck",
      "deck": 1,
      "shift": true,
      "ch": 1,
      "kind": "note",
      "code": 96,
      "status": 144
    },
    {
      "id": "deck1_tempo_msb",
      "name": "TEMPO MSB",
      "fig": "1-11",
      "section": "deck",
      "deck": 1,
      "shift": false,
      "ch": 1,
      "kind": "cc",
      "code": 0,
      "status": 176
    },
    {
      "id": "deck1_tempo_lsb",
      "name": "TEMPO LSB",
      "fig": "1-11",
      "section": "deck",
      "deck": 1,
      "shift": false,
      "ch": 1,
      "kind": "cc",
      "code": 32,
      "status": 176
    },
    {
      "id": "deck2_play_pause",
      "name": "PLAY/PAUSE",
      "fig": "1-1",
      "section": "deck",
      "deck": 2,
      "shift": false,
      "ch": 2,
      "kind": "note",
      "code": 11,
      "status": 145
    },
    {
      "id": "deck2_play_pause_shift",
      "name": "PLAY/PAUSE +SHIFT",
      "fig": "1-1",
      "section": "deck",
      "deck": 2,
      "shift": true,
      "ch": 2,
      "kind": "note",
      "code": 14,
      "status": 145
    },
    {
      "id": "deck2_cue",
      "name": "CUE",
      "fig": "1-2",
      "section": "deck",
      "deck": 2,
      "shift": false,
      "ch": 2,
      "kind": "note",
      "code": 12,
      "status": 145
    },
    {
      "id": "deck2_cue_shift",
      "name": "CUE +SHIFT",
      "fig": "1-2",
      "section": "deck",
      "deck": 2,
      "shift": true,
      "ch": 2,
      "kind": "note",
      "code": 72,
      "status": 145
    },
    {
      "id": "deck2_shift",
      "name": "SHIFT",
      "fig": "1-3",
      "section": "deck",
      "deck": 2,
      "shift": false,
      "ch": 2,
      "kind": "note",
      "code": 63,
      "status": 145
    },
    {
      "id": "deck2_jog_vinyl_on",
      "name": "JOG DIAL vinyl on",
      "fig": "1-4",
      "section": "deck",
      "deck": 2,
      "shift": false,
      "ch": 2,
      "kind": "cc",
      "code": 34,
      "status": 177
    },
    {
      "id": "deck2_jog_vinyl_off",
      "name": "JOG DIAL vinyl off",
      "fig": "1-4",
      "section": "deck",
      "deck": 2,
      "shift": false,
      "ch": 2,
      "kind": "cc",
      "code": 35,
      "status": 177
    },
    {
      "id": "deck2_jog_vinyl_shift",
      "name": "JOG DIAL +SHIFT",
      "fig": "1-4",
      "section": "deck",
      "deck": 2,
      "shift": true,
      "ch": 2,
      "kind": "cc",
      "code": 41,
      "status": 177
    },
    {
      "id": "deck2_jog_touch",
      "name": "JOG DIAL touch",
      "fig": "1-4",
      "section": "deck",
      "deck": 2,
      "shift": false,
      "ch": 2,
      "kind": "note",
      "code": 54,
      "status": 145
    },
    {
      "id": "deck2_jog_touch_shift",
      "name": "JOG DIAL touch +SHIFT",
      "fig": "1-4",
      "section": "deck",
      "deck": 2,
      "shift": true,
      "ch": 2,
      "kind": "note",
      "code": 103,
      "status": 145
    },
    {
      "id": "deck2_jog_wheel",
      "name": "JOG DIAL wheel side",
      "fig": "1-4",
      "section": "deck",
      "deck": 2,
      "shift": false,
      "ch": 2,
      "kind": "cc",
      "code": 33,
      "status": 177
    },
    {
      "id": "deck2_in",
      "name": "IN",
      "fig": "1-5",
      "section": "deck",
      "deck": 2,
      "shift": false,
      "ch": 2,
      "kind": "note",
      "code": 16,
      "status": 145
    },
    {
      "id": "deck2_in_shift",
      "name": "IN +SHIFT",
      "fig": "1-5",
      "section": "deck",
      "deck": 2,
      "shift": true,
      "ch": 2,
      "kind": "note",
      "code": 76,
      "status": 145
    },
    {
      "id": "deck2_out",
      "name": "OUT",
      "fig": "1-6",
      "section": "deck",
      "deck": 2,
      "shift": false,
      "ch": 2,
      "kind": "note",
      "code": 17,
      "status": 145
    },
    {
      "id": "deck2_out_shift",
      "name": "OUT +SHIFT",
      "fig": "1-6",
      "section": "deck",
      "deck": 2,